"what are some recipes with chicken.","CNKLLQD8","1","8T8QYK4W","1","5WDWRJNM","1","2PLY4ML5","1","3CDHXNCN","1","2C2LTJGN","1","5NRFHZQM","1","SZJNQ2KW","1","CHKWVS57","1"
"what are some recipes that serve 4 people.","VL7YDHTM","1","Y2M8RPQ7","1","L56KG4ZY","1","JKW6K6FY","1","BKKPSNWZ","1","DFTJYYVL","1","K3QMSVGL","1","34WH4TNM","1","JBT6PXMC","1","XQ2H6CZJ","1","W3VB7JXV","1","MMSRTRB","1","KKJYS7YF"
"what are some spicy recipes.","CHKWVS57","1","PFMCCRTR","1","JBWQNKX7","1","RXT2FGTT","1","5TZK4KPK","1","NVVD5RDS","1","J5KZXTDJ","1","YZJWCCMP","1","B3XQ8STW","1","V7VF28CS","1","QQXRGNHS","1"
"what are some chinese recipes.","LNTFHNH5","1","RXPRMMKD","1","PFJ7S66Z","1","XKZHJXCD","1","56BMQ85F","1","MYHBLFNG","1","JLZY4CCJ","1","SHZT3LYP","1"
"what are some recipes that serve 6 people.","M4GV5MLL","1","PCGF66GD","1","8BZXLH5J","1","LTZKBHNW","1","6C6FRYQF","1","4SLW8J3K","1","D3GJ76QB","1"
"what are some recipes with cream.","W5DLTDMX","1","NTQ25NQH","1","DX5T3WMR","1","GM3YFNJY","1","846JZQ2X","1","724PNNTQ","1"
"what are some recipes with peppers."
"what are some recipes with linguine.","N34VN6F2","1","8J52DJLD","1","HSJ88C5P","1","XQMQSGJD","1","KZ8PH2D2","1","HQXLWM25","1","G6BXNTQC","1","VX4WTMCH","1"
"what are some chilean recipes with steak."
"what are some vegan recipes with broccoli."
"what are some curry recipes with coconut."
"what are some recipes with sugar that serve 3 people."
"what are some recipes with butter."
"what are some sweet and spicy recipes.","QQXRGNHS","1","MLMMPDJM","1","7KNY6XH3","1","2ZF5G885","1","VT6F2ZDZ","1","2TFPLGTG","FRMF4HRH","1"
"what are some apple pie recipes with brown sugar."
"what are some soup recipes with onion and salt.","Y6YT6DKN","1","QKMCCDLP","1","GWH65RLW","1","VNGHNCS8","1","DX5T3WMR","1","QY22YL6W","1","44YCJLCY","1"
"what are some gluten-free recipes.","KMV325XP","1","52VKTBL5","1","845PJH52","1","6K5WSPPT","1","JY52TD7J","1","R8BYGBTN","1","SD5S5KXP","1"
"what are some panini recipes with mozzarella.","RFS4CBJ8","1","MGY686TB","1","QCFSY5P4","1"
"what are some almond recipes with chocolate."
"what are some Asian recipes with soy sauce and beef."
"what are some fish recipes with onions."
"what are some recipes with flour and sugar that serve 4 people."
"what are some spicy taco recipes.","K2574MM","1","XGWNFS5Q","1","ZXY3FRGR","1"
"what are some greek recipes with lamb."
"what are some shrimp recipes with cheese.","B7LWW8LX","1","MVSNGGZN","1","6V5NQDLF","1","476BQSYP","1","KMZPXTFM","1","ZC365DT7","1","TVMGWD4T","1"
"what are some BBQ recipes with eggs.","27D7RB2X","1","GRQ64XNZ","1","LYFPVS5X","1","XPL6M4JK","1"
"what are some recipes with cream cheese that serve 4 people."
"what are some baking recipes.","M86V3LH7","1","LHKPGTL7","1","L22YJSGR","1","37CVNNR7","1","KGNM6PFY","1","BDLXQ85Q","1","3XTDMN35","1","3RS8JBV3","1"
"what are some low-fat dessert recipes with chocolate."
"what are some Italian pasta dishes with alfredo."
"what are some recipes with steak, potatoes, and onions."
"what are some Summer recipes.","CZJX8K2J","1","K7K5C44X","1","8MPH7ZCM","1","QVV2XV82","1","YKVQMYQC","1","JFKXFTKT","1","XXQTPS3M","1","B7G4R5D8","1"
"what are some Christmas recipes with nutmeg.","CD44DQH5","1","8C775XYC","1","RSK674XC","1","FHY3BN2B","1","BFPHH5TN","1","H678VSDN","1","G2V7BWTZ","1","QLVYPX42","1"
"what are some German recipes with onions and potatoes.","XM4VRW6G","1","RNP64Y67","1","32J2Y2CN","1","2BC72L2V","1","S66FMNMX","1"
"what are some Mexican recipes that serve 2 people.","72D2KBL8","1","BWJZZTGQ","1","SJ557ZQF","1","KSYVL36R","1","7ZGXNR2F","1","VFRZ7FZS","1"
"what are some casserole recipes with spinach."
"what are some vegetable recipes with rice."
"what are some Moroccan recipes with chicken and cumin."
"what are some recipes with peppers and onions."
"what are some African recipes.","Y4PLS7YG","1","HX67365V","1","P7M3FWRB","1","6756H33V","1","MT3WYC73","1","TZKRPJ6G","1"
"what are some recipes with milk."
"what are some Cajun recipes with sausage."
"what are some healthy recipes with rice."
"what are some alcoholic recipes.","S2QSM56Q","1","CCWPJTXK","1","PZHZ7NBV","1","ZC73K3H5","1","8NT3XG76","1"
"what are some recipes with celery and carrots.","33BD22M2","1","65WNJX5S","1","ZGFZ5K8W","1","2Q2MHNDF","1","FVW6MJXK","1"
"what are some cake recipes that serve at least 6 people.","4MGSQPXX","1","KT6PPG3D","1","PCGF66GD","1","8BZXLH5J","1","J52FS4SW","1","8XR6KTFN","1","DZ3QRDF7"
"what are some steak recipes that serve 1 person.","J24CK6N8","1"
"what are some ice cream recipes.","2G7SG686","1","5BK3BDXY","1","87RDR8VZ","1","WGM3YMVS","1","633F8V4D","1","33N4XQ8C","1"
"what are some salad recipes with tomatoes.","W585RV57","1","XHQ33P3Z","1","NTFSJ7C4","1","BNS4J4BS","1","GPCD3SV6","1","4BN2BVQ","1","ZCRN8JDC","1"